Kimi no Na Wa(Your Name);26/08/2016;"Mitsuha est une lycéenne qui réside dans une petite ville située dans les montagnes. Elle vit aux côtés de sa petite soeur, sa grand-mère ainsi que son père, bien que ce dernier ne soit jamais à la maison à cause de son travail de maire. En réalité, sa vie ne lui convient pas et souhaite pouvoir vivre à Tokyo. 
Taki est un lycéen qui habite à Tokyo et qui adore l'architecture et l'art. Il vit une vie normale d'étudiant entouré d'amis et travaille même dans un petit restaurant italien. Mais un jour, il fait un rêve dans lequel il est dans la peau d'une jeune fille qui vit dans une ville en montagne. Mitsuha, quant à elle, fait également un rêve dans lequel elle est dans un corps d'un garçon tokyoïte. 
Quel est le secret qui se cache derrière ces étranges rêves qui échangent la vie de ces deux jeunes gens ?";Makoto Shinkai;Romance
The Foreigner;30/09/2017;A Londres, un modeste propriétaire de restaurant de Chinatown va tenter de retrouver les terroristes irlandais responsables de la mort de sa fille.;Martin Campbell;Action
Ip Man;12/12/2008;Au début des années 1930, la ville de Foshan est prospère et y fleurissent les écoles d'arts martiaux chinois. Pourtant, le meilleur d'entre eux, Ip Man, expert en wing chun, préfère cacher ses talents et profiter de ses rentes pour passer du temps en famille et s'entraîner.;Wilson Yip;Action
;;;;
